{
  "$schema": "http://json-schema.org/draft-07/schema#",
  "$id": "peggle/config.v1.schema.json",
  "title": "Peggle Evolved SimConfig v1",
  "type": "object",
  "required": ["format", "schema_version", "source_sha256", "values"],
  "additionalProperties": false,
  "properties": {
    "format": { "enum": ["peggle.config"] },
    "schema_version": { "enum": [1] },
    "source_sha256": { "type": "string", "pattern": "^[0-9a-f]{64}$" },
    "values": {
      "type": "object",
      "additionalProperties": true
    }
  }
}
