{"format":"peggle.config","schema_version":1,"source_sha256":"455757c900c604563865b5195eda2f31cfeba3d8666b6d782390e38c47e91d4d","values":{"aim_angle_limit":1.5707963267948966,"aim_discretization_steps":1800,"aim_fine_adjust_speed":0.52359877559829882,"aim_wheel_adjust":0.034906585039886591,"annular_cap_epsilon":0.01,"background_color":[0.10000000000000001,0.10000000000000001,0.14999999999999999],"ball_ball_collisions":true,"ball_ball_restitution":0.80000000000000004,"ball_color":[0.90000000000000002,0.90000000000000002,0.90000000000000002],"ball_radius":6,"ball_still_speed":18,"ball_wake_speed_multiplier":1.5,"bounce_min_normal_speed":200,"bucket_accel_multiplier":0.14999999999999999,"bucket_bonus":10000,"bucket_color":[0.84999999999999998,0.71999999999999997,0.28000000000000003],"bucket_edge":12,"bucket_height":26,"bucket_hole":70,"bucket_incremental_base":2500,"bucket_margin":30,"circuit_speedup_multiplier":5,"clear_no_score_time":10.5,"clear_still_time":0.59999999999999998,"current_level_name":"level1","default_peg_type":"blue","double_long_shot_points":2000,"fall_out_margin":80,"fever_bucket_raise_speed":300,"fixed_dt":0.016666666666666666,"fullscreen":true,"gravity":1000,"graze_tolerance":0.5,"launch_speed":800,"long_shot_distance":400,"long_shot_points":1000,"lucky_bounce_points":2500,"off_the_wall_min_distance":150,"off_the_wall_points":5000,"overlap_push_margin":0.10000000000000001,"peg_lit_blend":0.59999999999999998,"peg_radius":10,"peg_rect_height":12,"peg_rect_width":30,"peg_types":{"blue":{"color":[0.29999999999999999,0.55000000000000004,1],"value":10},"green":{"color":[0.29999999999999999,1,0.45000000000000001],"value":10},"purple":{"color":[0.69999999999999996,0.29999999999999999,1],"value":500},"red":{"color":[1,0.29999999999999999,0.29999999999999999],"value":100}},"peg_vanish_interval":0.080000000000000002,"purple_pegs_per_turn":1,"restitution":0.80000000000000004,"rotation_sweep_arc_px":0.5,"rotation_sweep_max_slices":32,"safe_t_margin":0.001,"settle_restitution":0.20000000000000001,"slide_invert_contact_timeout":0.29999999999999999,"slide_invert_lowest_tie":1,"slide_invert_tangent_epsilon":2,"slide_min_pegs":5,"slide_points":5000,"starting_balls":10,"super_long_shot_distance":700,"super_long_shot_points":5000,"toi_epsilon":1.0000000000000001e-09,"virtual_height":1900,"virtual_width":1200,"wall_damping":0.80000000000000004,"window_height":1080,"window_width":1920}}
